{
  "schema_version": "1.0.0",
  "correlation_id": "11111111-1111-4111-8111-111111111111",
  "candidate_group_id": "44444444-4444-4444-8444-444444444444",
  "verification_version": "1.0.0",
  "input_fingerprint": "sha256:example-verification-input",
  "overall_status": "CORROBORATED",
  "claim_decisions": [
    {
      "claim_id": "77777777-7777-4777-8777-777777777777",
      "status": "SUPPORTED",
      "supporting_evidence_refs": ["66666666-6666-4666-8666-666666666666"],
      "contradicting_evidence_refs": [],
      "reason_codes": ["EXPLICIT_RESULT_STATEMENT"]
    }
  ],
  "confidence_summary": 0.96,
  "required_review": false,
  "review_reasons": []
}
